{
  "schema_version": "2.0.0",
  "project": "Eigen Foundry",
  "canonical_repository": "SangLeeVX/eigen-foundry",
  "classification": "NONCANONICAL_ENGINEERING_STATE",
  "updated_at": "2026-08-16T11:33:33.928364Z",
  "active_build_mandate": {
    "mandate_id": "BUILD-EIGEN-FOUNDRY-003",
    "version": "1.0",
    "document_path": "FOUNDRY_MASTER_BUILD_PLAN.md",
    "plan_sha256": "sha256:91956a8194ed22697c8c013115d766f097143e6ed376da8b87cd504163ee7e45",
    "approved_repository_head": "ae1e6acebfde703312b882302c4137bfd06faa9e",
    "authoring_run_id": "foundry-codex-20260814-master-plan",
    "status": "ACTIVE",
    "approved_at": "2026-08-14T10:53:39Z",
    "approvals": [
      {
        "approval_id": "APR-BUILD-EIGEN-FOUNDRY-003-MANDATE",
        "approver": "Sang H. Lee",
        "actor_ref": "github:SangLeeVX",
        "actor_kind": "HUMAN",
        "role": "BUILD_MANDATE_OWNER",
        "decision": "APPROVED",
        "approved_at": "2026-08-14T10:53:39Z",
        "expires_at": null,
        "conditions": "Invalidates on a material change to the bound plan or reviewed repository head.",
        "bound_plan_sha256": "sha256:91956a8194ed22697c8c013115d766f097143e6ed376da8b87cd504163ee7e45",
        "bound_repository_head": "ae1e6acebfde703312b882302c4137bfd06faa9e",
        "evidence": "https://github.com/SangLeeVX/eigen-foundry/issues/17#issuecomment-5292491688"
      },
      {
        "approval_id": "APR-BUILD-EIGEN-FOUNDRY-003-ENGINEERING",
        "approver": "Sang H. Lee",
        "actor_ref": "github:SangLeeVX",
        "actor_kind": "HUMAN",
        "role": "ENGINEERING_AUTHORITY",
        "decision": "APPROVED",
        "approved_at": "2026-08-14T10:53:39Z",
        "expires_at": null,
        "conditions": "Invalidates on a material change to the bound plan or reviewed repository head.",
        "bound_plan_sha256": "sha256:91956a8194ed22697c8c013115d766f097143e6ed376da8b87cd504163ee7e45",
        "bound_repository_head": "ae1e6acebfde703312b882302c4137bfd06faa9e",
        "evidence": "https://github.com/SangLeeVX/eigen-foundry/issues/17#issuecomment-5292491688"
      },
      {
        "approval_id": "APR-BUILD-EIGEN-FOUNDRY-003-GOVERNANCE",
        "approver": "Sang H. Lee",
        "actor_ref": "github:SangLeeVX",
        "actor_kind": "HUMAN",
        "role": "FOUNDRY_GOVERNANCE_SAFETY_AUTHORITY",
        "decision": "APPROVED",
        "approved_at": "2026-08-14T10:53:39Z",
        "expires_at": null,
        "conditions": "Invalidates on a material change to the bound plan or reviewed repository head.",
        "bound_plan_sha256": "sha256:91956a8194ed22697c8c013115d766f097143e6ed376da8b87cd504163ee7e45",
        "bound_repository_head": "ae1e6acebfde703312b882302c4137bfd06faa9e",
        "evidence": "https://github.com/SangLeeVX/eigen-foundry/issues/17#issuecomment-5292491688"
      }
    ],
    "independent_review": {
      "review_id": "github-pr-review:4936490163",
      "reviewer_run_id": "/root/master_plan_review",
      "authoring_run_id": "foundry-codex-20260814-master-plan",
      "verdict": "PASS",
      "reviewed_repository_head": "ae1e6acebfde703312b882302c4137bfd06faa9e",
      "evidence": "https://github.com/SangLeeVX/eigen-foundry/pull/18#pullrequestreview-4936490163"
    }
  },
  "migration": {
    "migration_id": "MIGRATE-P-CHECKPOINTS-TO-M-v2",
    "created_at": "2026-08-14T10:55:49Z",
    "actor_run_id": "foundry-codex-20260814-m0-checkpoint-migration",
    "status": "ACTIVE",
    "status_inheritance": false,
    "therapeutic_program_state_changes": false,
    "source": {
      "schema_version": "1.0.0",
      "schema_sha256": "sha256:a88c4abce157a16a676d1ce3be0738900f59fdbaea62c80b78a994f7f90048aa",
      "state_sha256": "sha256:996d5d73344e63535f5a8d77b42c10046d7dac1a56251a1916b518414359ddf6",
      "archived_schema_path": "forge/contracts/legacy/checkpoints-v1.schema.json",
      "archived_state_path": "forge/state/legacy/checkpoints-v1.0.0.json"
    },
    "blueprint": {
      "document_id": "BUILD-EIGEN-FOUNDRY-002",
      "version": "0.2",
      "library_path": "/Drug Foundry w eigenfield/EIGEN_FOUNDRY_EXECUTION_BLUEPRINT_v0.2.md",
      "sha256": "sha256:78f386f1132a57824a879c77ffce611b7bf2726619e7a68a32b576fac6f03b9c"
    },
    "crosswalk": [
      {
        "source_id": "P0",
        "namespace": "LEGACY_ENGINEERING_PHASE",
        "target_milestones": [
          "M1"
        ],
        "treatment": "CARRIED",
        "status_inherited": false,
        "criterion_routes": [
          {
            "source_criterion_id": "P0-C1",
            "target_milestones": [
              "M1"
            ]
          },
          {
            "source_criterion_id": "P0-C2",
            "target_milestones": [
              "M1"
            ]
          },
          {
            "source_criterion_id": "P0-C3",
            "target_milestones": [
              "M1"
            ]
          },
          {
            "source_criterion_id": "P0-C4",
            "target_milestones": [
              "M1"
            ]
          },
          {
            "source_criterion_id": "P0-C5",
            "target_milestones": [
              "M1"
            ]
          }
        ]
      },
      {
        "source_id": "P1",
        "namespace": "LEGACY_ENGINEERING_PHASE",
        "target_milestones": [
          "M1"
        ],
        "treatment": "CARRIED",
        "status_inherited": false,
        "criterion_routes": [
          {
            "source_criterion_id": "P1-C1",
            "target_milestones": [
              "M1"
            ]
          }
        ]
      },
      {
        "source_id": "P2",
        "namespace": "LEGACY_ENGINEERING_PHASE",
        "target_milestones": [
          "M1"
        ],
        "treatment": "CARRIED",
        "status_inherited": false,
        "criterion_routes": [
          {
            "source_criterion_id": "P2-C1",
            "target_milestones": [
              "M1"
            ]
          }
        ]
      },
      {
        "source_id": "P3",
        "namespace": "LEGACY_ENGINEERING_PHASE",
        "target_milestones": [
          "M2"
        ],
        "treatment": "CARRIED",
        "status_inherited": false,
        "criterion_routes": [
          {
            "source_criterion_id": "P3-C1",
            "target_milestones": [
              "M2"
            ]
          }
        ]
      },
      {
        "source_id": "P4",
        "namespace": "LEGACY_ENGINEERING_PHASE",
        "target_milestones": [
          "M3",
          "M4"
        ],
        "treatment": "SPLIT",
        "status_inherited": false,
        "criterion_routes": [
          {
            "source_criterion_id": "P4-C1",
            "target_milestones": [
              "M3"
            ]
          }
        ]
      },
      {
        "source_id": "P5",
        "namespace": "LEGACY_ENGINEERING_PHASE",
        "target_milestones": [
          "M6"
        ],
        "treatment": "CARRIED",
        "status_inherited": false,
        "criterion_routes": [
          {
            "source_criterion_id": "P5-C1",
            "target_milestones": [
              "M6"
            ]
          }
        ]
      },
      {
        "source_id": "P6",
        "namespace": "LEGACY_ENGINEERING_PHASE",
        "target_milestones": [
          "M5"
        ],
        "treatment": "CARRIED",
        "status_inherited": false,
        "criterion_routes": [
          {
            "source_criterion_id": "P6-C1",
            "target_milestones": [
              "M5"
            ]
          }
        ]
      },
      {
        "source_id": "P7",
        "namespace": "LEGACY_ENGINEERING_PHASE",
        "target_milestones": [
          "M7",
          "M9"
        ],
        "treatment": "SPLIT",
        "status_inherited": false,
        "criterion_routes": [
          {
            "source_criterion_id": "P7-C1",
            "target_milestones": [
              "M7",
              "M9"
            ]
          }
        ]
      },
      {
        "source_id": "B0",
        "namespace": "LEGACY_BUILD_FOUNDATION",
        "target_milestones": [
          "M1"
        ],
        "treatment": "CARRIED",
        "status_inherited": false,
        "criterion_routes": []
      },
      {
        "source_id": "B0.5",
        "namespace": "LEGACY_BUILD_FOUNDATION",
        "target_milestones": [
          "M1"
        ],
        "treatment": "CARRIED",
        "status_inherited": false,
        "criterion_routes": []
      },
      {
        "source_id": "B1",
        "namespace": "LEGACY_BUILD_FOUNDATION",
        "target_milestones": [
          "M1"
        ],
        "treatment": "CARRIED",
        "status_inherited": false,
        "criterion_routes": []
      },
      {
        "source_id": "B2",
        "namespace": "LEGACY_BUILD_FOUNDATION",
        "target_milestones": [
          "M1"
        ],
        "treatment": "CARRIED",
        "status_inherited": false,
        "criterion_routes": []
      },
      {
        "source_id": "LEGACY_BUILD_F1",
        "namespace": "LEGACY_BUILD_INCREMENT",
        "target_milestones": [
          "M2"
        ],
        "treatment": "CARRIED",
        "status_inherited": false,
        "criterion_routes": []
      },
      {
        "source_id": "LEGACY_BUILD_F2",
        "namespace": "LEGACY_BUILD_INCREMENT",
        "target_milestones": [
          "M3"
        ],
        "treatment": "CARRIED",
        "status_inherited": false,
        "criterion_routes": []
      },
      {
        "source_id": "LEGACY_BUILD_F3",
        "namespace": "LEGACY_BUILD_INCREMENT",
        "target_milestones": [
          "M4"
        ],
        "treatment": "CARRIED",
        "status_inherited": false,
        "criterion_routes": []
      },
      {
        "source_id": "LEGACY_BUILD_F4",
        "namespace": "LEGACY_BUILD_INCREMENT",
        "target_milestones": [
          "M6"
        ],
        "treatment": "CARRIED",
        "status_inherited": false,